ID,Title,Tags,Difficulty,Solved,Accepted
1519F,Chests and Keys,"bitmasks, brute force, dfs and similar, dp, flows",3200,299,0
1519E,Off by One,"constructive algorithms, dfs and similar, geometry, graphs, sortings, trees",2700,745,0
1519D,Maximum Sum of Products,"brute force, dp, implementation, math, two pointers",1600,13510,0
1519C,Berland Regional,"brute force, data structures, greedy, number theory, sortings",1400,14889,0
1519B,The Cake Is a Lie,"dp, math",800,27952,0
1519A,Red and Blue Beans,math,800,26880,0
1517H,Fly Around the World,"dp, geometry",3500,57,0
1517G,Starry Night Camping,"constructive algorithms, flows, graphs",3300,369,0
1517F,Reunion,"combinatorics, dp, trees",3200,332,0
1517E,Group Photo,"binary search, data structures, implementation, two pointers",2500,910,0
1517D,Explorer Space,"dp, graphs, shortest paths",1800,6851,0
1517C,Fillomino 2,"constructive algorithms, dfs and similar, greedy, implementation",1400,12503,0
ID,Title,Tags,Difficulty,Solved,Accepted
1517B,Morning Jogging,"constructive algorithms, greedy, sortings",1200,12771,0
1517A,Sum of 2050,"greedy, math",800,24209,0
1516E,Baby Ehab Plays with Permutations,"combinatorics, dp, math",2500,754,0
1516D,Cut,"binary search, data structures, dp, graphs, number theory, two pointers",2100,3744,0
1516C,Baby Ehab Partitions Again,"bitmasks, constructive algorithms, dp, math",1700,10826,0
1516B,AGAGA XOOORRR,"bitmasks, brute force, dp, greedy",1500,16585,0
1516A,Tit for Tat,greedy,800,22648,0
1515I,Phoenix and Diamonds,"binary search, data structures, sortings",3400,193,0
1515H,Phoenix and Bits,"bitmasks, brute force, data structures, sortings",3500,190,0
1515G,Phoenix and Odometers,"dfs and similar, graphs, math, number theory",2700,787,0
1515F,Phoenix and Earthquake,"constructive algorithms, dfs and similar, dsu, graphs, greedy, trees",2600,1476,0
1515E,Phoenix and Computers,"combinatorics, dp, math",2200,3093,0
1515D,Phoenix and Socks,"greedy, sortings, two pointers",1500,10685,0
1515C,Phoenix and Towers,"constructive algorithms, data structures, greedy",1400,15423,0
1515B,Phoenix and Puzzle,"brute force, geometry, math, number theory",1000,22548,0
1515A,Phoenix and Gold,"constructive algorithms, greedy, math",800,19633,0
1514E,Baby Ehab's Hyper Apartment,"binary search, graphs, interactive, sortings, two pointers",2700,504,0
1514D,Cut and Stick,"binary search, data structures, greedy, implementation, sortings",2000,3831,0
1514C,Product 1 Modulo N,"greedy, number theory",1600,12945,0
1514B,"AND 0, Sum Big","bitmasks, combinatorics, math",1200,19973,0
1514A,Perfectly Imperfect Array,"math, number theory",800,23135,0
1513F,Swapping Problem,"brute force, constructive algorithms, data structures, sortings",2500,1083,0
1513E,Cost Equilibrium,"combinatorics, constructive algorithms, math, sortings",2300,1333,0
1513D,GCD and MST,"constructive algorithms, dsu, graphs, greedy, number theory, sortings",2000,4551,0
1513C,Add One,"dp, matrices",1600,11937,0
1513B,AND Sequences,"bitmasks, combinatorics, constructive algorithms, math",1400,12560,0
1513A,Array and Peaks,"constructive algorithms, implementation",800,18800,0
1512G,Short Task,"brute force, dp, math, number theory",1700,7206,0
1512F,Education,"brute force, dp, greedy, implementation",1900,5521,0
1512E,Permutation by Sum,"brute force, greedy, math",1600,9416,0
1512D,Corrupted Array,"constructive algorithms, data structures, greedy",1200,20102,0
1512C,A-B Palindrome,"constructive algorithms, implementation, strings",1200,18356,0
1512B,Almost Rectangle,implementation,800,24311,0
1512A,Spy Detected!,"brute force, implementation",800,51937,0
1511G,Chips on a Board,"bitmasks, brute force, data structures, dp, games, two pointers",2700,559,0
1511F,Chainword,"brute force, data structures, dp, matrices, string suffix structures, strings",2700,372,0
1511E,Colorings and Dominoes,"combinatorics, dp, greedy, math",2100,2334,0
1511D,Min Cost String,"brute force, constructive algorithms, graphs, greedy, strings",1600,10459,0
1511C,Yet Another Card Deck,"brute force, data structures, implementation, trees",1100,20230,0
1511B,GCD Length,"constructive algorithms, math, number theory",1100,20734,0
1511A,Review Site,greedy,800,26223,0
1510K,King's Task,"brute force, graphs, implementation",1200,5016,0
1510J,Japanese Game,"constructive algorithms, math",2700,402,0
1510I,Is It Rated?,"greedy, interactive, math, probabilities",2700,404,0
1510H,Hard Optimization,dp,3200,83,0
1510G,Guide,,2100,1191,0
1510F,Fiber Shape,,2800,51,0
1510E,Equilibrium Point /\textbackslash/\textbackslash,,2700,196,0
1510D,Digits,"dp, math, number theory",2100,1672,0
1510C,Cactus Not Enough,"dfs and similar, graph matchings, graphs",2900,170,0
1510B,Button Lock,"flows, graph matchings, graphs",2600,630,0
1510A,ASCII Automata Art,,3100,135,0
1509C,The Sports Festival,"dp, greedy",1800,10747,0
1509B,TMT Document,greedy,1100,20255,0
1509A,Average Height,constructive algorithms,800,24846,0
1508F,Optimal Encoding,"brute force, data structures",3500,91,0
1508E,Tree Calendar,"brute force, constructive algorithms, data structures, dfs and similar, sortings, trees",3100,306,0
1508D,Swap Pass,"constructive algorithms, geometry, sortings",3000,458,0
1508C,Complete the MST,"bitmasks, brute force, data structures, dfs and similar, dsu, graphs, greedy, trees",2500,1299,0
1508B,Almost Sorted,"binary search, combinatorics, constructive algorithms, implementation",1800,3612,0
1508A,Binary Literature,"constructive algorithms, greedy, implementation, strings, two pointers",1900,5716,0
1506G,Maximize the Remaining String,"brute force, data structures, dp, greedy, strings",2000,3815,0
1506F,Triangular Paths,"constructive algorithms, graphs, math, shortest paths, sortings",2000,2936,0
1506E,Restoring the Permutation,"constructive algorithms, implementation",1500,11858,0
1506D,Epic Transformation,"constructive algorithms, data structures, greedy",1400,18878,0
1506C,Double-ended Strings,"brute force, implementation, strings",1000,21765,0
1506B,Partial Replacement,"greedy, implementation",1100,19166,0
1506A,Strange Table,math,800,28833,0
1505I,"Mysterious language again, seriously?",*special problem,2200,486,0
1505H,L BREAK into program,*special problem,2500,445,0
1505G,Encoded message,"*special problem, implementation",2600,266,0
1505F,Math,"*special problem, math",2200,1394,0
1505E,Cakewalk,"*special problem, greedy, implementation, shortest paths",1800,1660,0
1505D,Xenolith? Hippodrome?,"*special problem, number theory",1800,691,0
1505C,Fibonacci Words,"*special problem, implementation",1400,6041,0
1505B,DMCA,"*special problem, implementation, number theory",1600,5722,0
1505A,Is it rated - 2,"*special problem, implementation, interactive",900,13175,0
1504B,Flip the Bits,"constructive algorithms, greedy, implementation, math",1200,16117,0
1504A,Déjà Vu,"constructive algorithms, strings",800,20790,0
1503F,Balance the Cards,"constructive algorithms, data structures, divide and conquer, geometry, graphs, implementation",3500,113,0
1503E,2-Coloring,"combinatorics, dp, math",3100,522,0
1503D,Flip the Cards,"2-sat, constructive algorithms, data structures, greedy, sortings, two pointers",2600,898,0
1503C,Travelling Salesman Problem,"binary search, data structures, dp, greedy, shortest paths, sortings, two pointers",2200,2948,0
1503B,3-Coloring,"constructive algorithms, games, interactive",1700,6598,0
1503A,Balance the Bits,"constructive algorithms, greedy",1600,12385,0
1501B,Napoleon Cake,"dp, implementation, sortings",900,17521,0
1501A,Alexey and Train,implementation,800,11424,0
1500F,Cupboards Jumps,dp,3500,235,0
1500E,Subset Trick,"binary search, data structures",3300,167,0
1500D,Tiles for Bathroom,"data structures, sortings, two pointers",2900,347,0
1500C,Matrix Sorting,"bitmasks, brute force, constructive algorithms, greedy, two pointers",2600,684,0
1500B,Two chandeliers,"binary search, brute force, chinese remainder theorem, math, number theory",2200,1910,0
1500A,Going Home,"brute force, hashing, implementation, math",1800,8163,0
1499G,Graph Coloring,"data structures, graphs, interactive",3100,170,0
1499F,Diameter Cuts,"combinatorics, dfs and similar, dp, trees",2400,1071,0
1499E,Chaotic Merge,"combinatorics, dp, math, strings",2400,1295,0
1499D,The Number of Pairs,"dp, math, number theory",2100,4994,0
1499C,Minimum Grid Path,"brute force, data structures, greedy, math",1500,11815,0
1499B,Binary Removals,"brute force, dp, greedy, implementation",1000,19505,0
1499A,Domino on Windowsill,"combinatorics, constructive algorithms, math",800,20692,0
1498F,Christmas Game,"bitmasks, data structures, dfs and similar, dp, games, math, trees",2500,707,0
1498E,Two Houses,"brute force, graphs, greedy, interactive, sortings",2200,1711,0
1498D,Bananas in a Microwave,"dfs and similar, dp, graphs, implementation",2200,2164,0
1498C,Planar Reflections,"brute force, data structures, dp",1600,8621,0
1498B,Box Fitting,"binary search, bitmasks, data structures, greedy",1300,14949,0
1498A,GCD Sum,"brute force, math",800,21813,0
1497E2,Square-free division (hard version),"data structures, dp, greedy, math, number theory, two pointers",2500,1406,0
1497E1,Square-Free Division (easy version),"data structures, dp, greedy, math, number theory, two pointers",1700,7556,0
1497D,Genius,"bitmasks, dp, graphs, number theory",2500,1366,0
1497C2,k-LCM (hard version),"constructive algorithms, math",1600,15203,0
1497C1,k-LCM (easy version),"constructive algorithms, math",1200,22401,0
1497B,M-arrays,"constructive algorithms, greedy, math",1200,17278,0
1497A,Meximization,"brute force, data structures, greedy, sortings",800,23152,0
1496B,Max and Mex,math,1100,16686,0
1496A,Split it!,"brute force, constructive algorithms, greedy, strings",900,19521,0
1495F,Squares,"constructive algorithms, data structures, dp, graphs, trees",3300,231,0
1495E,Qingshan and Daniel,"brute force, data structures, greedy, implementation",3200,361,0
1495D,BFS Trees,"combinatorics, dfs and similar, graphs, math, shortest paths, trees",2600,1042,0
1495C,Garden of the Sun,"constructive algorithms, graphs",2300,2381,0
1495B,Let's Go Hiking,"games, greedy",1900,5597,0
1495A,Diamond Miner,"geometry, greedy, math, sortings",1200,15996,0
1494F,Delete The Edges,"brute force, constructive algorithms, dfs and similar, graphs, implementation",2900,308,0
1494E,A-Z Graph,"constructive algorithms, data structures, graphs, hashing",2400,1550,0
1494D,Dogeforces,"constructive algorithms, data structures, dfs and similar, divide and conquer, dsu, greedy, sortings, trees",2300,2380,0
1494C,1D Sokoban,"binary search, dp, greedy, implementation, two pointers",1900,5026,0
1494B,Berland Crossword,"bitmasks, brute force, greedy, implementation",1400,13350,0
1494A,ABC String,"bitmasks, brute force, implementation",900,19711,0
1493F,Enchanted Matrix,"bitmasks, interactive, number theory",2600,338,0
1493E,Enormous XOR,"bitmasks, constructive algorithms, greedy, math, strings, two pointers",2600,795,0
1493D,GCD of an Array,"brute force, data structures, hashing, implementation, math, number theory, sortings, two pointers",2100,4359,0
1493C,K-beautiful Strings,"binary search, brute force, constructive algorithms, greedy, strings",2000,4264,0
1493B,Planet Lapituletti,"brute force, implementation",1300,11251,0
1493A,Anti-knapsack,"constructive algorithms, greedy",800,18699,0
1492E,Almost Fault-Tolerant Database,"brute force, constructive algorithms, dfs and similar, greedy, implementation",2500,1125,0
1492D,Genius's Gambit,"bitmasks, constructive algorithms, greedy, math",1900,5679,0
1492C,Maximum width,"binary search, data structures, dp, greedy, two pointers",1500,14695,0
1492B,Card Deck,"data structures, greedy, math",1100,17415,0
1492A,Three swimmers,math,800,21989,0
1491I,Ruler Of The Zoo,"brute force, data structures",3500,64,0
1491H,Yuezheng Ling and Dynamic Tree,"data structures, trees",3400,611,0
1491G,Switch and Flip,"constructive algorithms, graphs, math",2800,633,0
1491F,Magnets,"binary search, constructive algorithms, interactive",2700,854,0
1491E,Fib-tree,"brute force, dfs and similar, divide and conquer, number theory, trees",2400,1883,0
1491D,Zookeeper and The Infinite Zoo,"bitmasks, constructive algorithms, dp, greedy, math",1800,6468,0
1491C,Pekora and Trampoline,"brute force, data structures, dp, greedy, implementation",1700,7388,0
1491B,Minimal Cost,"brute force, math",1200,13203,0
1491A,K-th Largest Value,"brute force, greedy, implementation",800,17732,0
1490G,Old Floppy Drive,"binary search, data structures, math",1900,5107,0
1490F,Equalize the Array,"binary search, data structures, greedy, math, sortings",1500,14163,0
1490E,Accidental Victory,"binary search, data structures, greedy",1400,16660,0
1490D,Permutation Transformation,"dfs and similar, divide and conquer, implementation",1200,17734,0
1490C,Sum of Cubes,"binary search, brute force, brute force, math",1100,28265,0
1490B,Balanced Remainders,"brute force, constructive algorithms, math",1000,24279,0
1490A,Dense Array,"greedy, math",800,29210,0
1488J,Flower Shop,"*special problem, data structures, fft, math",3100,24,0
1488I,Demonic Invasion,"*special problem, flows",3100,26,0
1488H,Build From Suffixes,"*special problem, combinatorics, data structures",2800,42,0
1488G,Painting Numbers,"*special problem, data structures, greedy, number theory",2500,103,0
1488F,Dogecoin,"*special problem, *special problem, binary search, data structures",2300,141,0
1488E,Palindromic Doubles,"*special problem, data structures, dp",2200,178,0
1488D,Problemsolving Marathon,"*special problem, binary search, greedy",1900,296,0
1488C,Two Policemen,"*special problem, binary search, brute force, math",1900,373,0
1488B,RBS Deletion,"*special problem, greedy",1800,499,0
1488A,From Zero To Y,"*special problem, math",900,1195,0
1487G,String Counting,"combinatorics, dp, fft, math",2700,533,0
1487F,Ones,"dp, greedy, shortest paths",2900,338,0
1487E,Cheap Dinner,"brute force, data structures, graphs, greedy, implementation, sortings, two pointers",2000,4110,0
1487D,Pythagorean Triples,"binary search, brute force, math, number theory",1500,15636,0
1487C,Minimum Ties,"brute force, constructive algorithms, dfs and similar, graphs, greedy, implementation, math",1500,12902,0
1487B,Cat Cycle,"math, number theory",1200,17864,0
1487A,Arena,"implementation, sortings",800,25435,0
1486F,Pairs of Paths,"combinatorics, data structures, dfs and similar, dp, trees",2600,537,0
1486E,Paired Payment,"binary search, brute force, constructive algorithms, dp, flows, graphs, shortest paths",2200,2627,0
1486D,Max Median,"binary search, data structures, dp",2100,5803,0
1486C2,Guessing the Greatest (hard version),"binary search, interactive",1900,7523,0
1486C1,Guessing the Greatest (easy version),"binary search, interactive",1600,10740,0
1486B,Eastern Exhibition,"binary search, geometry, shortest paths, sortings",1500,14378,0
1486A,Shifting Stacks,"greedy, implementation",900,23598,0
1485F,Copy or Prefix Sum,"combinatorics, data structures, dp, sortings",2400,1700,0
1485E,Move and Swap,"dfs and similar, dp, greedy, trees",2500,1146,0
1485D,Multiples and Power Differences,"constructive algorithms, graphs, math, number theory",2200,4680,0
1485C,Floor and Mod,"binary search, brute force, math, number theory",1700,8918,0
1485B,Replace and Keep Sorted,"dp, implementation, math",1200,15872,0
1485A,Add and Divide,"brute force, greedy, math, number theory",1000,19326,0
1482H,Exam,"data structures, string suffix structures, trees",3400,289,0
1482G,Vabank,"binary search, interactive",3200,218,0
1482F,Useful Edges,"graphs, shortest paths",2400,1375,0
1482E,Skyline Photo,"data structures, divide and conquer, dp",2100,2676,0
1482D,Playlist,"data structures, dsu, implementation, shortest paths",1900,3574,0
1482C,Basic Diplomacy,"brute force, constructive algorithms, greedy, implementation",1600,8756,0
1482B,Restore Modulo,"implementation, math",1500,8733,0
1482A,Prison Break,math,800,19735,0
1481F,AB Tree,"dp, greedy, trees",3100,402,0
1481E,Sorting Books,"data structures, dp, greedy",2500,1831,0
1481D,AB Graph,"brute force, constructive algorithms, graphs, greedy, implementation",2000,4185,0
1481C,Fence Painting,"brute force, constructive algorithms, greedy",1600,10681,0
1481B,New Colony,"brute force, greedy, implementation",1100,18494,0
1481A,Space Navigation,"greedy, strings",800,23941,0
1480B,The Great Hero,"greedy, implementation, sortings",900,16403,0
1480A,Yet Another String Game,"games, greedy, strings",800,24770,0
1479E,School Clubs,"dp, fft, math, number theory, probabilities",3500,123,0
1479D,Odd Mineral Resource,"binary search, bitmasks, brute force, data structures, probabilities, trees",2900,812,0
1479C,Continuous City,"bitmasks, constructive algorithms",2500,1167,0
1479B2,Painting the Array II,"constructive algorithms, data structures, dp, greedy, implementation",2100,3671,0
1479B1,Painting the Array I,"constructive algorithms, data structures, dp, greedy, implementation",1900,6413,0
1479A,Searching Local Minimum,"binary search, interactive, ternary search",1700,10367,0
1478C,Nezzar and Symmetric Array,"implementation, math, sortings",1700,9031,0
1478B,Nezzar and Lucky Number,"brute force, dp, greedy, math",1100,17562,0
1478A,Nezzar and Colorful Balls,"brute force, greedy",800,24832,0
1477F,Nezzar and Chocolate Bars,"combinatorics, fft, math, probabilities",3500,102,0
1477E,Nezzar and Tournaments,"data structures, greedy",3300,106,0
1477D,Nezzar and Hidden Permutations,"constructive algorithms, dfs and similar, graphs",2800,465,0
1477C,Nezzar and Nice Beatmap,"constructive algorithms, geometry, greedy, math, sortings",2200,2081,0
1477B,Nezzar and Binary String,"data structures, greedy",1900,2921,0
1477A,Nezzar and Board,"constructive algorithms, math, number theory",1800,5401,0
1476G,Minimum Difference,"data structures, hashing, sortings, two pointers",3100,458,0
1476F,Lanterns,"binary search, data structures, dp",3000,459,0
1476E,Pattern Matching,"bitmasks, data structures, dfs and similar, graphs, hashing, sortings, strings",2300,2105,0
1476D,Journey,"dfs and similar, dp, dsu, implementation",1700,8001,0
1476C,Longest Simple Cycle,"dp, graphs, greedy",1600,10517,0
1476B,Inflation,"binary search, brute force, greedy, math",1300,18420,0
1476A,K-divisible Sum,"binary search, constructive algorithms, greedy, math",1000,31240,0
1475G,Strange Beauty,"dp, math, number theory, sortings",1900,5806,0
1475F,Unusual Matrix,"2-sat, brute force, constructive algorithms",1900,4757,0
1475E,Advertising Agency,"combinatorics, math, sortings",1600,11854,0
1475D,Cleaning the Phone,"binary search, dp, sortings, two pointers",1800,8990,0
1475C,Ball in Berland,"combinatorics, graphs, math",1400,18521,0
1475B,New Year's Number,"brute force, dp, math",900,41600,0
1475A,Odd Divisor,"math, number theory",900,47271,0
1474F,1 2 3 4 ...,"dp, math, matrices",3000,179,0
1474E,What Is It?,"constructive algorithms, greedy",2500,1231,0
1474D,Cleaning,"data structures, dp, greedy, math",2200,3707,0
1474C,Array Destruction,"brute force, constructive algorithms, data structures, greedy, implementation, sortings",1700,11421,0
1474B,Different Divisors,"binary search, constructive algorithms, greedy, math, number theory",1000,24026,0
1474A,Puzzle From the Future,greedy,800,21842,0
1473G,Tiles,"combinatorics, dp, fft, math",2800,342,0
1473F,Strange Set,"flows, math",2700,812,0
1473E,Minimum Path,"graphs, shortest paths",2400,2828,0
1473D,Program,"data structures, dp, implementation, strings",1700,8748,0
1473C,No More Inversions,"constructive algorithms, math",1500,11917,0
1473B,String LCM,"brute force, math, number theory, strings",1000,27516,0
1473A,Replacing Elements,"greedy, implementation, math, sortings",800,31307,0
1472G,Moving to the Capital,"dfs and similar, dp, graphs, shortest paths",2100,3955,0
1472F,New Year's Puzzle,"brute force, dp, graph matchings, greedy, sortings",2100,2778,0
1472E,Correct Placement,"binary search, data structures, dp, sortings, two pointers",1700,7235,0
1472D,Even-Odd Game,"dp, games, greedy, sortings",1200,23977,0
1472C,Long Jumps,"dp, graphs",1100,27447,0
1472B,Fair Division,"dp, greedy, math",800,42897,0
1472A,Cards for Friends,"greedy, math",800,38464,0
1471B,Strange List,"brute force, greedy, implementation, math",1100,18566,0
1471A,Strange Partition,"greedy, math, number theory",900,22874,0
1470F,Strange Covering,divide and conquer,3500,100,0
1470E,Strange Permutation,"binary search, combinatorics, data structures, dp, graphs, implementation, two pointers",3200,251,0
1470D,Strange Housing,"constructive algorithms, dfs and similar, graph matchings, graphs, greedy",2200,3337,0
1470C,Strange Shuffle,"binary search, brute force, constructive algorithms, interactive",2500,1245,0
1470B,Strange Definition,"bitmasks, graphs, hashing, math, number theory",1900,5873,0
1470A,Strange Birthday Party,"binary search, dp, greedy, sortings, two pointers",1300,19837,0
1469F,Power Sockets,"binary search, data structures, greedy",2600,774,0
1469E,A Bit Similar,"bitmasks, brute force, hashing, string suffix structures, strings, two pointers",2400,1739,0
1469D,Ceil Divisions,"brute force, constructive algorithms, math, number theory",1700,8711,0
1469C,Building a Fence,"dp, greedy, implementation, two pointers",1600,10009,0
1469B,Red and Blue,"dp, greedy",1000,24274,0
1469A,Regular Bracket Sequence,"constructive algorithms, greedy",1000,24804,0
1468N,Waste Sorting,"greedy, implementation",900,7501,0
1468M,Similar Sets,"data structures, graphs, implementation",2300,765,0
1468L,Prime Divisors Selection,"binary search, greedy, math, number theory",2700,282,0
1468K,The Robot,"brute force, implementation",1600,4706,0
1468J,Road Reform,"dsu, graphs, greedy",1800,3503,0
1468I,Plane Tiling,"geometry, implementation, math",2500,459,0
1468H,K and Medians,"constructive algorithms, greedy, math",2200,1594,0
1468G,Hobbits,"binary search, geometry",2500,748,0
1468F,Full Turn,"geometry, hashing, number theory",1700,3366,0
1468E,Four Segments,greedy,800,8317,0
1468D,Firecrackers,"binary search, sortings",1700,4136,0
1468C,Berpizza,"data structures, implementation",1400,6825,0
1468B,Bakery,"data structures, dsu",2900,170,0
1468A,LaIS,"data structures, dp, greedy",2200,1434,0
1467E,Distinctive Roots in a Tree,"data structures, dfs and similar, dp, trees",2500,1194,0
1467D,Sum of Paths,"combinatorics, dp, math",2200,3384,0
1467C,Three Bags,"constructive algorithms, greedy",1900,5960,0
1467B,Hills And Valleys,"brute force, implementation",1700,10322,0
1467A,Wizard of Orz,"constructive algorithms, greedy, math",900,23127,0
1466I,The Riddle of the Sphinx,"binary search, data structures, data structures, interactive",3400,153,0
1466H,Finding satisfactory solutions,"combinatorics, dp, graphs, greedy, math",3300,187,0
1466G,Song of the Sirens,"combinatorics, divide and conquer, hashing, math, string suffix structures, strings",2600,770,0
1466F,Euclid's nightmare,"bitmasks, dfs and similar, dsu, graphs, greedy, math, sortings",2100,2705,0
1466E,Apollo versus Pan,"bitmasks, brute force, math",1800,6510,0
1466D,13th Labour of Heracles,"data structures, greedy, sortings, trees",1500,10347,0
1466C,Canine poetry,"dp, greedy, strings",1300,16617,0
1466B,Last minute enhancements,"dp, greedy",800,21822,0
1466A,Bovine Dilemma,"brute force, geometry, math",800,21904,0
1464F,My Beautiful Madness,"data structures, trees",3500,224,0
1463F,Max Correct Set,"bitmasks, dp, math",3100,485,0
1463E,Plan of Lectures,"constructive algorithms, dfs and similar, dsu, graphs, implementation, sortings, trees",2400,1336,0
1463D,Pairs,"binary search, constructive algorithms, greedy, two pointers",1900,4019,0
1463C,Busy Robot,implementation,1800,5218,0
1463B,Find The Array,"bitmasks, constructive algorithms, greedy",1400,17354,0
1463A,Dungeon,"binary search, math",1100,22804,0
1462F,The Treasure of The Segments,"binary search, data structures, greedy",1800,6169,0
1462E2,Close Tuples (hard version),"binary search, combinatorics, implementation, math, sortings, two pointers",1700,8445,0
1462E1,Close Tuples (easy version),"binary search, combinatorics, math, sortings, two pointers",1500,12316,0
1462D,Add to Neighbour and Remove,"greedy, math, number theory",1400,15247,0
1462C,Unique Number,"brute force, greedy, math",900,28776,0
1462B,Last Year's Substring,"dp, implementation, strings",800,25571,0
1462A,Favorite Sequence,"implementation, two pointers",800,36791,0
1461F,Mathematical Expression,"constructive algorithms, dp, greedy",2700,459,0
1461E,Water Level,"brute force, graphs, greedy, implementation, math",2200,1984,0
1461D,Divide and Summarize,"binary search, brute force, data structures, divide and conquer, implementation, sortings",1600,8469,0
1461C,Random Events,"dp, math, probabilities",1500,10372,0
1461B,Find the Spruce,"brute force, dp, implementation",1400,11907,0
1461A,String Generation,"constructive algorithms, greedy",800,18169,0
1459B,Move and Turn,"dp, math",1300,13092,0
1459A,Red-Blue Shuffle,"math, probabilities",800,16319,0
1458F,Range Diameter Sum,"data structures, trees",3500,197,0
1458E,Nim Shortcuts,"data structures, games",3100,337,0
1458D,Flip and Reverse,"data structures, graphs, greedy",3100,785,0
1458C,Latin Square,"math, matrices",2700,1080,0
1458B,Glass Half Spilled,dp,2000,3179,0
1458A,Row GCD,"math, number theory",1600,14274,0
1456E,XOR-ranges,"dp, greedy",3500,218,0
1455G,Forbidden Value,"data structures, dp",2900,330,0
1455F,String and Operations,"dp, greedy",2800,388,0
1455E,Four Points,"brute force, constructive algorithms, flows, geometry, greedy, implementation, math, ternary search",2400,1366,0
