ID,Title,Tags,Difficulty,Solved,Accepted
1866M,Mighty Rock Tower,"combinatorics, dp, math, probabilities",0,256,0
1866L,Lihmuf Balling,"brute force, math",0,254,0
1866K,Keen Tree Calculation,"binary search, data structures, dp, geometry, trees",0,148,0
1866J,Jackets and Packets,dp,0,80,0
1866I,Imagination Castle,"dp, games, two pointers",0,247,0
1866H,Happy Sets,combinatorics,0,755,0
1866G,Grouped Carriages,"binary search, data structures, dp, flows, greedy",0,648,0
1866F,Freak Joker Process,"binary search, data structures, sortings",0,27,0
1866E,Elevators of Tamem,dp,0,67,0
1866D,Digital Wallet,"dp, greedy",0,464,0
1866C,Completely Searching for Inversions,"dfs and similar, dp, graphs",0,1467,0
1866B,Battling with Numbers,"combinatorics, math, number theory",0,3819,0
1866A,Ambitious Kid,math,0,7752,0
1864I,Future Dominators,"graphs, greedy",0,34,0
1864H,Asterism Stream,"dp, math, matrices",0,122,0
1864G,Magic Square,"combinatorics, constructive algorithms, implementation",0,167,0
1864F,Exotic Queries,"data structures, implementation, sortings",0,943,0
1864E,Guess Game,"bitmasks, data structures, games, math, probabilities, sortings, strings, trees",0,1955,0
1864D,Matrix Cascade,"brute force, constructive algorithms, data structures, dp, greedy, math",0,5335,0
1864C,Divisor Chain,"bitmasks, constructive algorithms, math, number theory",0,10172,0
1864B,Swap and Reverse,"constructive algorithms, greedy, sortings, strings",0,12695,0
1864A,Increasing and Decreasing,"constructive algorithms, greedy, implementation, math",0,17578,0
1863I,Redundant Routes,"constructive algorithms, dp, trees",0,15,0
1863H,Goldberg Machine 3,"dp, trees",0,19,0
1863G,Swaps,"combinatorics, dp, graphs, math",0,270,0
1863F,"Divide, XOR, and Conquer","bitmasks, dp, math",0,585,0
1863E,Speedrun,"brute force, dfs and similar, dp, graphs, greedy, math, sortings, two pointers",0,1879,0
1863D,Two-Colored Dominoes,"constructive algorithms, greedy",0,6571,0
1863C,MEX Repetition,"implementation, math",0,10549,0
1863B,Split Sort,"greedy, math, sortings",0,11428,0
1863A,Channel,"greedy, implementation",0,14448,0
1862G,The Great Equalizer,"binary search, data structures, math, sortings",0,1771,0
1862F,Magic Will Save the World,"binary search, bitmasks, brute force, dp",0,3915,0
1862E,Kolya and Movie Theatre,"constructive algorithms, data structures, greedy",0,6914,0
1862D,Ice Cream Balls,"binary search, combinatorics, constructive algorithms, math",0,12749,0
1862C,Flower City Fence,"binary search, data structures, implementation, sortings",0,16022,0
1862B,Sequence Game,constructive algorithms,0,22820,0
1862A,Gift Carpet,"dp, greedy, implementation, strings",0,25070,0
1861F,Four Suits,"binary search, bitmasks, flows, greedy",0,37,0
1861E,Non-Intersecting Subpermutations,"combinatorics, dp, implementation, math",0,881,0
1861D,Sorting By Multiplication,"dp, greedy",0,3850,0
1861C,Queries for the Array,"data structures, dfs and similar, implementation, strings, trees",0,6346,0
1861B,Two Binary Strings,"constructive algorithms, dp, greedy",0,14212,0
1861A,Prime Deletion,"constructive algorithms, math",0,17992,0
1860F,Evaluate RBS,"data structures, geometry, implementation, math, sortings",0,157,0
1860E,Fast Travel Text Editor,"data structures, dfs and similar, graphs, shortest paths",0,923,0
1860D,Balanced String,dp,0,2043,0
1860C,Game on Permutation,"data structures, dp, games, greedy",0,9950,0
1860B,Fancy Coins,"binary search, brute force, greedy, math",0,12974,0
1860A,Not a Substring,"constructive algorithms, strings",0,17951,0
1859F,Teleportation in Byteland,"data structures, dfs and similar, divide and conquer, graphs, shortest paths, trees",3200,252,0
1859E,Maximum Monogonosity,"brute force, dp, math",2500,1298,0
1859D,Andrey and Escape from Capygrad,"binary search, data structures, dp, dsu, greedy, sortings",1800,5159,0
1859C,Another Permutation Problem,"brute force, dp, greedy, math",1200,13453,0
1859B,Olya and Game with Arrays,"constructive algorithms, greedy, math, sortings",1000,18783,0
1859A,United We Stand,"constructive algorithms, math, number theory",800,23718,0
1858E2,Rollbacks (Hard Version),"data structures, interactive, trees",2600,701,0
1858E1,Rollbacks (Easy Version),"brute force, data structures, dfs and similar, trees",2500,929,0
1858D,Trees and Segments,"brute force, data structures, dp, greedy, two pointers",2200,2059,0
1858C,Yet Another Permutation Problem,"constructive algorithms, greedy, math, number theory",1000,18393,0
1858B,The Walkway,"brute force, dp, greedy, math, number theory",1500,8637,0
1858A,Buttons,"games, greedy, math",800,26433,0
1857G,Counting Graphs,"combinatorics, divide and conquer, dsu, graphs, greedy, sortings, trees",2000,3085,0
1857F,Sum and Product,"binary search, data structures, math",1600,7681,0
1857E,Power of Points,"math, sortings",1500,9027,0
1857D,Strong Vertices,"math, sortings, trees",1300,14477,0
1857C,Assembly via Minimums,"greedy, sortings",1200,17852,0
1857B,Maximum Rounding,"greedy, implementation, math",1100,18995,0
1857A,Array Coloring,"greedy, math",800,34611,0
1856E2,PermuTree (hard version),"bitmasks, dfs and similar, dp, fft, greedy, implementation, math, trees",2700,1002,0
1856E1,PermuTree (easy version),"dfs and similar, dp, trees",1800,3762,0
1856D,More Wrong,"divide and conquer, interactive",2100,2507,0
1856C,To Become Max,"binary search, brute force, data structures, dp",1600,8550,0
1856B,Good Arrays,"implementation, math",900,18828,0
1856A,Tales of a Sort,implementation,800,22587,0
1855B,Longest Divisors Interval,"brute force, combinatorics, greedy, math, number theory",900,19032,0
1855A,Dalton the Teacher,"greedy, math",800,23808,0
1854F,Mark and Spaceship,"brute force, dp",3500,69,0
1854E,Game Bundles,"brute force, constructive algorithms, dp, greedy, math",3000,260,0
1854D,Michael and Hotel,"binary search, interactive, trees",3000,350,0
1854C,Expected Destruction,"combinatorics, dp, math, probabilities",2500,1010,0
1854B,Earn or Unlock,"bitmasks, brute force, dp",2200,2666,0
1854A2,Dual (Hard Version),"constructive algorithms, math",1900,5548,0
1854A1,Dual (Easy Version),"constructive algorithms, math",1400,11057,0
1853B,Fibonaccharsis,"binary search, brute force, math",1200,13796,0
1853A,Desorting,"brute force, greedy, math",800,22425,0
1852F,Panda Meetups,"data structures, dp, flows",3500,70,0
1852E,Rivalries,"constructive algorithms, data structures, greedy",3400,106,0
1852D,Miriany and Matchstick,"constructive algorithms, dp, greedy",2800,322,0
1852C,Ina of the Mountain,"data structures, dp, greedy, math",2400,1120,0
1852B,Imbalanced Arrays,"constructive algorithms, graphs, greedy, math, sortings, two pointers",1800,3143,0
1852A,Ntarsis' Set,"binary search, math, number theory",1800,6097,0
1851G,Vlad and the Mountains,"binary search, data structures, dsu, graphs, implementation, sortings, trees, two pointers",2000,2120,0
1851F,Lisa and the Martians,"bitmasks, greedy, math, strings, trees",1800,4032,0
1851E,Nastya and Potions,"dfs and similar, dp, graphs, sortings",1500,7170,0
1851D,Prefix Permutation Sums,"implementation, math",1300,11677,0
1851C,Tiles Comeback,greedy,1000,18402,0
1851B,Parity Sort,"greedy, sortings, two pointers",800,23591,0
1851A,Escalator Conversations,"brute force, constructive algorithms, math",800,25307,0
1850H,The Third Letter,"dfs and similar, dsu, graphs, greedy, implementation",1700,5593,0
1850G,The Morning Star,"combinatorics, data structures, geometry, implementation, math, sortings",1500,8444,0
1850F,We Were Both Children,"brute force, implementation, math, number theory",1300,12970,0
1850E,Cardboard for Pictures,"binary search, geometry, implementation, math",1100,16131,0
1850D,Balanced Round,"brute force, greedy, implementation, sortings",900,24195,0
1850C,Word on the Paper,"implementation, strings",800,31384,0
1850B,Ten Words of Wisdom,"implementation, sortings",800,31878,0
1850A,To My Critics,"implementation, sortings",800,36363,0
1849F,XOR Partition,"binary search, bitmasks, data structures, divide and conquer, greedy, trees",2700,457,0
1849E,Max to the Right of Min,"binary search, data structures, divide and conquer, dp, dsu, two pointers",2300,1105,0
1849D,Array Painting,"constructive algorithms, greedy, two pointers",1700,6142,0
1849C,Binary String Copying,"binary search, brute force, data structures, hashing, strings",1600,7908,0
1849B,Monsters,"greedy, math, sortings",1000,17677,0
1849A,Morning Sandwich,"implementation, math",800,23664,0
1848F,Vika and Wiki,"binary search, bitmasks, combinatorics, divide and conquer, dp, math",2400,1145,0
1848E,Vika and Stone Skipping,"brute force, implementation, math, number theory",2600,610,0
1848D,Vika and Bonuses,"binary search, brute force, math, ternary search",2200,2097,0
1848C,Vika and Price Tags,"math, number theory",1800,4923,0
1848B,Vika and the Bridge,"binary search, data structures, greedy, implementation, math, sortings",1200,10695,0
1848A,Vika and Her Friends,"games, math",900,14087,0
1847F,The Boss's Identity,"binary search, bitmasks, data structures, dfs and similar, greedy, math, sortings",2500,707,0
1847E,Triangle Platinum?,"brute force, combinatorics, implementation, interactive, math, probabilities",2900,273,0
1847D,Professor Higashikata,"data structures, dsu, greedy, implementation, strings",1900,3040,0
1847C,"Vampiric Powers, anyone?","bitmasks, brute force, dp, greedy",1400,10329,0
1847B,Hamon Odyssey,"bitmasks, greedy, two pointers",1000,16334,0
1847A,The Man who became a God,"greedy, sortings",800,19925,0
1846G,Rudolf and CodeVid-23,"bitmasks, dp, graphs, greedy, shortest paths",1900,3280,0
1846F,Rudolph and Mimic,"constructive algorithms, implementation, interactive",1800,2278,0
1846E2,Rudolf and Snowflakes (hard version),"binary search, brute force, implementation, math",1800,5471,0
1846E1,Rudolf and Snowflakes (simple version),"brute force, implementation, math",1300,12777,0
1846D,Rudolph and Christmas Tree,"constructive algorithms, geometry, math",1200,15518,0
1846C,Rudolf and the Another Competition,"constructive algorithms, data structures, dp, greedy, sortings",1200,15289,0
1846B,Rudolph and Tic-Tac-Toe,"brute force, implementation, strings",800,22959,0
1846A,Rudolph and Cut the Rope,"implementation, math",800,28004,0
1845F,Swimmers in the Pool,"dp, fft, math, number theory",2800,278,0
1845E,Boxes and Balls,"dp, implementation, math",2500,1041,0
1845D,Rating System,"binary search, brute force, data structures, dp, dsu, greedy, math, two pointers",1800,6101,0
1845C,Strong Password,"binary search, dp, greedy, strings",1400,11149,0
1845B,Come Together,"geometry, implementation, math",900,18318,0
1845A,Forbidden Integer,"constructive algorithms, implementation, math, number theory",800,20730,0
1844H,Multiple of Three Cycles,"combinatorics, data structures, dp, dsu, math",3400,78,0
1844G,Tree Weights,"bitmasks, constructive algorithms, data structures, dfs and similar, implementation, math, matrices, number theory, trees",3000,407,0
1844F2,Min Cost Permutation (Hard Version),"binary search, constructive algorithms, data structures, greedy, math, sortings",2800,294,0
1844F1,Min Cost Permutation (Easy Version),"brute force, constructive algorithms, greedy, math",2600,624,0
1844E,Great Grids,"2-sat, constructive algorithms, dfs and similar, dsu, graphs",2400,1478,0
1844D,Row Major,"constructive algorithms, greedy, math, number theory, strings",1400,9974,0
1844C,Particles,"dp, greedy, implementation, math",1300,12701,0
1844B,Permutations & Primes,"constructive algorithms, math",1000,15396,0
1844A,Subtraction Game,"constructive algorithms, games",800,21716,0
1843F2,Omsk Metro (hard version),"data structures, dfs and similar, divide and conquer, dp, math, trees",2300,1145,0
1843F1,Omsk Metro (simple version),"data structures, dfs and similar, dp, graphs, greedy, math, trees",1800,4167,0
1843E,Tracking Segments,"binary search, brute force, data structures, two pointers",1600,8954,0
1843D,Apple Tree,"combinatorics, dfs and similar, dp, math, trees",1200,14479,0
1843C,Sum in Binary Tree,"bitmasks, combinatorics, math, trees",800,26274,0
1843B,Long Long,"greedy, math, two pointers",800,24824,0
1843A,Sasha and Array Coloring,"greedy, sortings, two pointers",800,29098,0
1842I,Tenzing and Necklace,"divide and conquer, dp, greedy",3500,85,0
1842H,Tenzing and Random Real Numbers,"bitmasks, dp, graphs, math, probabilities",3000,328,0
1842G,Tenzing and Random Operations,"combinatorics, dp, math, probabilities",2800,557,0
1842F,Tenzing and Tree,"dfs and similar, greedy, shortest paths, sortings, trees",2500,979,0
1842E,Tenzing and Triangle,"data structures, dp, geometry, greedy, math",2300,1283,0
1842D,Tenzing and His Animal Friends,"constructive algorithms, graphs, greedy",1900,3393,0
1842C,Tenzing and Balls,dp,1500,9087,0
1842B,Tenzing and Books,"bitmasks, greedy, math",1100,13247,0
1842A,Tenzing and Tsondu,"games, math",800,17810,0
1841F,Monocarp and a Strategic Game,"geometry, sortings, two pointers",2700,376,0
1841E,Fill the Matrix,"data structures, greedy, math",2200,1557,0
1841D,Pairs of Segments,"data structures, greedy, sortings, two pointers",2000,3411,0
1841C,Ranom Numbers,"brute force, dp, greedy, math, strings",1800,6309,0
1841B,Keep it Beautiful,implementation,1000,17952,0
1841A,Game with Board,"constructive algorithms, games",800,22373,0
1840G2,In Search of Truth (Hard Version),"constructive algorithms, interactive, math, meet-in-the-middle, probabilities",2500,713,0
1840G1,In Search of Truth (Easy Version),"constructive algorithms, interactive, math, meet-in-the-middle, probabilities",2200,1907,0
1840F,Railguns,"brute force, dfs and similar, dp, graphs",2200,1417,0
1840E,Character Blocking,"data structures, hashing, implementation",1600,6323,0
1840D,Wooden Toy Festival,"binary search, greedy, sortings",1400,10843,0
1840C,Ski Resort,"combinatorics, math, two pointers",1000,19968,0
1840B,Binary Cafe,"bitmasks, combinatorics, math",1100,18921,0
1840A,Cipher Shifer,"implementation, strings, two pointers",800,28709,0
1839E,Decreasing Game,"constructive algorithms, dfs and similar, dp, greedy, interactive",2400,920,0
1839D,Ball Sorting,"data structures, dp, sortings",2100,1799,0
1839C,Insert Zero and Invert Prefix,constructive algorithms,1300,9769,0
1839B,Lamps,"greedy, sortings",1100,12704,0
1839A,The Good Array,"greedy, implementation, math",800,15735,0
1838F,Stuck Conveyor,"binary search, constructive algorithms, interactive",3000,246,0
1838E,Count Supersequences,"combinatorics, dp, math",2500,1099,0
1838D,Bracket Walk,"data structures, greedy, strings",2100,2658,0
1838C,No Prime Differences,"constructive algorithms, math, number theory",1400,11326,0
1838B,Minimize Permutation Subarrays,"constructive algorithms, math",1100,14200,0
1838A,Blackboard List,"constructive algorithms, math",800,19277,0
1837F,Editorial for Two,"binary search, data structures, greedy, implementation",2400,1715,0
1837E,Playoff Fixing,"combinatorics, trees",2200,1825,0
1837D,Bracket Coloring,"constructive algorithms, greedy",1400,11311,0
1837C,Best Binary String,"constructive algorithms, greedy",1000,18745,0
1837B,Comparison String,greedy,900,22005,0
1837A,Grasshopper on a Line,"constructive algorithms, math",800,24692,0
1836B,Astrophysicists,"greedy, math",1100,10861,0
1836A,Destroyer,"implementation, sortings",800,17709,0
1835F,Good Graph,"bitmasks, dfs and similar, graph matchings, graphs, implementation",3500,94,0
1835E,Old Mobile,"combinatorics, dp, probabilities",3500,151,0
1835D,Doctor's Brown Hypothesis,"dfs and similar, graphs, math, number theory",2900,337,0
1835C,Twin Clusters,"bitmasks, brute force, constructive algorithms, math, probabilities",2600,745,0
1835B,Lottery,"binary search, brute force, greedy, math, two pointers",2500,699,0
1835A,k-th equality,"brute force, implementation, math",1700,6267,0
1834F,Typewriter,"brute force, math",2500,399,0
1834E,MEX of LCM,"binary search, data structures, implementation, math, number theory",2300,1580,0
1834D,Survey in Class,"brute force, data structures, greedy, implementation, sortings",1900,3509,0
1834C,Game with Reversing,"games, greedy, math, strings",1200,10528,0
1834B,Maximum Strength,"greedy, math",1000,12359,0
1834A,Unit Array,"greedy, math",800,16890,0
1833G,Ksyusha and Chinchilla,"constructive algorithms, dfs and similar, dp, dsu, greedy, implementation, trees",1800,3966,0
1833F,Ira and Flamenco,"combinatorics, constructive algorithms, data structures, implementation, math, sortings, two pointers",1700,5450,0
1833E,Round Dance,"dfs and similar, dsu, graphs, shortest paths",1600,8221,0
1833D,Flipper,"brute force, constructive algorithms, greedy",1400,11053,0
1833C,Vlad Building Beautiful Array,"greedy, math",800,23332,0
1833B,Restore the Weather,"greedy, sortings",900,22376,0
1833A,Musical Puzzle,"implementation, strings",800,28657,0
1832F,Zombies,"binary search, dp",3200,212,0
1832E,Combinatorics Problem,"brute force, combinatorics, dp",2200,1788,0
1832D2,Red-Blue Operations (Hard Version),"binary search, constructive algorithms, greedy, implementation, math",2400,1580,0
1832D1,Red-Blue Operations (Easy Version),"binary search, greedy, implementation, math",2100,2473,0
1832C,Contrast Value,"greedy, implementation",1200,14768,0
1832B,Maximum Sum,"brute force, sortings, two pointers",1100,16220,0
1832A,New Palindrome,strings,800,22325,0
1831B,Array merging,"constructive algorithms, greedy",1000,15333,0
1831A,Twin Permutations,constructive algorithms,800,20473,0
1830F,The Third Grace,"data structures, dp",3200,105,0
1830E,Bully Sort,"data structures, math",3500,151,0
1830D,Mex Tree,"brute force, dp, trees",2800,438,0
1830C,Hyperregular Bracket Strings,"combinatorics, greedy, hashing, math, number theory, sortings",2400,1251,0
1830B,The BOSS Can Count Pairs,"brute force, math",2000,3872,0
1830A,Copil Copac Draws Trees,"dfs and similar, dp, graphs, trees",1400,10453,0
1829H,Don't Blame Me,"bitmasks, combinatorics, dp, math",1700,5505,0
1829G,Hits Different,"data structures, dp, implementation, math",1600,7472,0
1829F,Forever Winter,"dfs and similar, graphs, math",1300,13113,0
1829E,The Lakes,"dfs and similar, dsu, graphs, implementation",1100,14906,0
1829D,Gold Rush,"brute force, dfs and similar, dp, implementation",1000,19675,0
1829C,Mr. Perfectly Fine,"bitmasks, greedy, implementation",800,23189,0
1829B,Blank Space,implementation,800,31605,0
1829A,Love Story,"implementation, strings",800,35185,0
1828B,Permutation Swap,"math, number theory",900,17228,0
1828A,Divisible Array,"constructive algorithms, math",800,20896,0
1827F,Copium Permutation,"constructive algorithms, data structures, greedy",3500,81,0
1827E,Bus Routes,"binary search, constructive algorithms, dfs and similar, greedy, trees",3400,284,0
1827D,Two Centroids,"data structures, dfs and similar, greedy, trees",2800,545,0
1827C,Palindrome Partition,"binary search, brute force, data structures, dp, hashing, strings",2600,930,0
1827B2,Range Sorting (Hard Version),"binary search, data structures, dp, greedy",2400,1480,0
1827B1,Range Sorting (Easy Version),"binary search, dp, dsu, greedy, trees, two pointers",2000,3168,0
1827A,Counting Orders,"combinatorics, math, sortings, two pointers",1100,15070,0
1826F,Fading into Fog,"geometry, interactive, math, probabilities",2800,283,0
1826E,Walk the Runway,"bitmasks, brute force, data structures, dp, graphs, implementation, sortings",2400,1266,0
1826D,Running Miles,"brute force, dp, greedy",1700,6233,0
1826C,Dreaming of Freedom,"greedy, math, number theory",1300,10685,0
1826B,Lunatic Never Content,"math, number theory",1100,12936,0
1826A,Trust Nobody,"brute force, greedy, implementation, sortings",1200,12456,0
1825B,LuoTianyi and the Table,"greedy, math",1000,12744,0
1825A,LuoTianyi and the Palindrome String,"greedy, strings",800,17538,0
1824E,LuoTianyi and Cartridge,"data structures, trees",3500,93,0
1824D,LuoTianyi and the Function,data structures,3000,344,0
1824C,LuoTianyi and XOR-Tree,"data structures, dfs and similar, dp, dsu, greedy, trees",2500,976,0
1824B2,LuoTianyi and the Floating Islands (Hard Version),"combinatorics, dfs and similar, math, probabilities, trees",2300,2157,0
1824B1,LuoTianyi and the Floating Islands (Easy Version),"combinatorics, math, probabilities, trees",1800,3699,0
1824A,LuoTianyi and the Show,"greedy, implementation",1400,9433,0
1823F,Random Walk,"dp, graphs, math, probabilities, trees",2600,556,0
1823E,Removing Graph,"brute force, dp, games, graphs, math",2500,1036,0
1823D,Unique Palindromes,"constructive algorithms, math, strings",1900,3152,0
1823C,Strongly Composite,"greedy, math, number theory",1300,10012,0
1823B,Sort with Step,"brute force, math, sortings",900,13524,0
1823A,A-characteristic,"combinatorics, constructive algorithms, math",800,14540,0
1822G2,Magic Triples (Hard Version),"brute force, data structures, math, number theory",2200,1865,0
1822G1,Magic Triples (Easy Version),"brute force, data structures, math, number theory",1700,5253,0
1822F,Gardening Friends,"brute force, dfs and similar, dp, graphs, trees",1700,4460,0
1822E,Making Anti-Palindromes,"greedy, math, strings",1600,7827,0
1822D,Super-Permutation,"constructive algorithms, math",1200,13606,0
1822C,Bun Lover,math,800,19979,0
1822B,Karina and Array,"greedy, math, sortings",800,21711,0
1822A,TubeTube Feed,"brute force, implementation",800,21487,0
1821F,Timber,"combinatorics, dp, fft, math",2600,580,0
1821E,Rearrange Brackets,"brute force, dp, greedy, sortings, strings",2100,1833,0
1821D,Black Cells,"binary search, brute force, greedy, math",1900,4096,0
1821C,Tear It Apart,"brute force, implementation, math, strings",1300,11485,0
1821B,Sort the Subarray,"brute force, greedy",1100,14509,0
1821A,Matching,"combinatorics, math",800,17665,0
1820B,JoJo's Incredible Adventures,"math, strings, two pointers",1100,11393,0
1820A,Yura's New Name,"implementation, strings",800,14994,0
1819F,"Willy-nilly, Crack, Into Release!","data structures, dp",3500,98,0
1819E,Roads in E City,"interactive, math, probabilities, trees",3200,184,0
1819D,Misha and Apples,"brute force, data structures, dp, two pointers",2800,502,0
1819C,The Fox and the Complete Tree Traversal,"constructive algorithms, dp, implementation, math, trees",2400,1176,0
1819B,The Butcher,"geometry, greedy, implementation, sortings, two pointers",1900,2964,0
1819A,Constructive Problem,"brute force, greedy",1300,10393,0
1818B,Indivisible,constructive algorithms,900,12244,0
1818A,Politics,"greedy, implementation",800,11783,0
1817F,Entangled Substrings,"string suffix structures, strings",3500,127,0
1817E,Half-sum,"brute force, divide and conquer, greedy",3400,199,0
1817D,Toy Machine,"constructive algorithms, games, implementation",2700,532,0
1817C,Similar Polynomials,"combinatorics, math",2400,795,0
1817B,Fish Graph,"brute force, constructive algorithms, dfs and similar, graphs",1900,3240,0
1817A,Almost Increasing Subsequence,"binary search, data structures, greedy",1500,8757,0
1816B,Grid Reconstruction,"constructive algorithms, greedy",1000,13323,0
1816A,Ian Visits Mary,"constructive algorithms, geometry, number theory",800,15695,0
1815F,OH NO1 (-2-3-4),"constructive algorithms, graphs, math",3500,184,0
1815E,Bosco and Particle,"dp, math, number theory, strings",3100,259,0
1815D,XOR Counting,"bitmasks, combinatorics, dp, math",2600,822,0
1815C,Between,"constructive algorithms, dfs and similar, graphs, greedy",2200,1597,0
1815B,Sum Graph,"brute force, constructive algorithms, graphs, implementation, interactive, shortest paths, trees",2000,2465,0
1815A,Ian and Array Sorting,"greedy, math",1300,11801,0
1814F,Communication Towers,"brute force, divide and conquer, dsu",2700,360,0
1814E,Chain Chips,"data structures, dp, matrices",2300,1040,0
1814D,Balancing Weapons,"binary search, brute force, data structures, math, two pointers",2500,711,0
1814C,Search in Parallel,"constructive algorithms, greedy, sortings",1500,8719,0
1814B,Long Legs,"brute force, math",1700,8239,0
1814A,Coins,"implementation, math",800,21794,0
1812J,Unmysterious Language,"*special problem, constructive algorithms, strings",0,4677,0
1812I,Mountain Climber,*special problem,0,192,0
1812H,Expected Twist,"*special problem, interactive",0,99,0
1812G,Colour Vision,"*special problem, implementation",0,390,0
1812F,Factorization,"*special problem, number theory",0,768,0
1812E,Not a Geometry Problem,"*special problem, *special problem, constructive algorithms, geometry, math",0,3412,0
1812D,Trivial Conjecture,"*special problem, constructive algorithms, math, number theory",0,3814,0
1812C,Digits,*special problem,0,979,0
1812B,Was it Rated?,"*special problem, *special problem, *special problem, brute force, implementation",0,4574,0
1812A,Are You a Robot?,"*special problem, *special problem, *special problem, expression parsing, strings",0,10760,0
1811G2,Vlad and the Nice Paths (hard version),"binary search, combinatorics, data structures, dp, math, two pointers",2200,1294,0
1811G1,Vlad and the Nice Paths (easy version),"combinatorics, dp, math",2100,1551,0
1811F,Is It Flower?,"dfs and similar, graphs, implementation",2100,1433,0
1811E,Living Sequence,"binary search, dp, math, number theory",1500,9668,0
1811D,Umka and a Long Flight,"constructive algorithms, implementation, math",1600,6020,0
1811C,Restore the Array,"constructive algorithms, greedy",1100,16770,0
1811B,Conveyor Belts,"implementation, math",1000,17771,0
1811A,Insert Digit,"greedy, math, strings",800,26646,0
1810H,Last Number,"combinatorics, math",2900,103,0
1810G,The Maximum Prefix,dp,3200,474,0
1810F,M-tree,"data structures, math, sortings, trees",2800,465,0
